Index Title,Leviticus
Leviticus 19:33,וכי יגור אתך גר בארצכם לא תונו אתו
Leviticus 19:34,כאזרח מכם יהיה לכם הגר הגר אתכם ואהבת לו כמוך כי גרים הייתם בארץ מצרים אני יהוה אלהיכם
Leviticus 19:35,לא תעשו עול במשפט במדה במשקל ובמשורה
Leviticus 19:36,מאזני צדק אבני צדק איפת צדק והין צדק יהיה לכם אני יהוה אלהיכם אשר הוצאתי אתכם מארץ מצרים
Leviticus 19:37,ושמרתם את כל חקתי ואת כל משפטי ועשיתם אתם אני יהוה
Leviticus 20:1,וידבר יהוה אל משה לאמר
Leviticus 20:2,ואל בני ישראל תאמר איש איש מבני ישראל ומן הגר הגר בישראל אשר יתן מזרעו למלך מות יומת עם הארץ ירגמהו באבן
Leviticus 20:3,ואני אתן את פני באיש ההוא והכרתי אתו מקרב עמו כי מזרעו נתן למלך למען טמא את מקדשי ולחלל את שם קדשי
Leviticus 20:4,ואם העלם יעלימו עם הארץ את עיניהם מן האיש ההוא בתתו מזרעו למלך לבלתי המית אתו
Leviticus 20:5,ושמתי אני את פני באיש ההוא ובמשפחתו והכרתי אתו ואת כל הזנים אחריו לזנות אחרי המלך מקרב עמם
Leviticus 20:6,והנפש אשר תפנה אל האבת ואל הידענים לזנות אחריהם ונתתי את פני בנפש ההוא והכרתי אתו מקרב עמו
Leviticus 20:7,והתקדשתם והייתם קדשים כי אני יהוה אלהיכם
Leviticus 20:8,ושמרתם את חקתי ועשיתם אתם אני יהוה מקדשכם
Leviticus 20:9,כי איש איש אשר יקלל את אביו ואת אמו מות יומת אביו ואמו קלל דמיו בו
Leviticus 20:10,ואיש אשר ינאף את אשת איש אשר ינאף את אשת רעהו מות יומת הנאף והנאפת
Leviticus 20:11,ואיש אשר ישכב את אשת אביו ערות אביו גלה מות יומתו שניהם דמיהם בם
Leviticus 20:12,ואיש אשר ישכב את כלתו מות יומתו שניהם תבל עשו דמיהם בם
Leviticus 20:13,ואיש אשר ישכב את זכר משכבי אשה תועבה עשו שניהם מות יומתו דמיהם בם
Leviticus 20:14,ואיש אשר יקח את אשה ואת אמה זמה הוא באש ישרפו אתו ואתהן ולא תהיה זמה בתוככם
Leviticus 20:15,ואיש אשר יתן שכבתו בבהמה מות יומת ואת הבהמה תהרגו
Leviticus 20:16,ואשה אשר תקרב אל כל בהמה לרבעה אתה והרגת את האשה ואת הבהמה מות יומתו דמיהם בם
Leviticus 20:17,ואיש אשר יקח את אחתו בת אביו או בת אמו וראה את ערותה והיא תראה את ערותו חסד הוא ונכרתו לעיני בני עמם ערות אחתו גלה עונו ישא
Leviticus 20:18,ואיש אשר ישכב את אשה דוה וגלה את ערותה את מקרה הערה והיא גלתה את מקור דמיה ונכרתו שניהם מקרב עמם
Leviticus 20:19,וערות אחות אמך ואחות אביך לא תגלה כי את שארו הערה עונם ישאו
Leviticus 20:20,ואיש אשר ישכב את דדתו ערות דדו גלה חטאם ישאו ערירים ימתו
Leviticus 20:21,ואיש אשר יקח את אשת אחיו נדה הוא ערות אחיו גלה ערירים יהיו
Leviticus 20:22,ושמרתם את כל חקתי ואת כל משפטי ועשיתם אתם ולא תקיא אתכם הארץ אשר אני מביא אתכם שמה לשבת בה
Leviticus 20:23,ולא תלכו בחקת הגוי אשר אני משלח מפניכם כי את כל אלה עשו ואקץ בם
Leviticus 20:24,ואמר לכם אתם תירשו את אדמתם ואני אתננה לכם לרשת אתה ארץ זבת חלב ודבש אני יהוה אלהיכם אשר הבדלתי אתכם מן העמים
Leviticus 20:25,והבדלתם בין הבהמה הטהרה לטמאה ובין העוף הטמא לטהר ולא תשקצו את נפשתיכם בבהמה ובעוף ובכל אשר תרמש האדמה אשר הבדלתי לכם לטמא
Leviticus 20:26,והייתם לי קדשים כי קדוש אני יהוה ואבדל אתכם מן העמים להיות לי
Leviticus 20:27,ואיש או אשה כי יהיה בהם אוב או ידעני מות יומתו באבן ירגמו אתם דמיהם בם
Leviticus 21:1,ויאמר יהוה אל משה אמר אל הכהנים בני אהרן ואמרת אלהם לנפש לא יטמא בעמיו
Leviticus 21:2,כי אם לשארו הקרב אליו לאמו ולאביו ולבנו ולבתו ולאחיו
Leviticus 21:3,ולאחתו הבתולה הקרובה אליו אשר לא היתה לאיש לה יטמא
Leviticus 21:4,לא יטמא בעל בעמיו להחלו
Leviticus 21:5,לא יקרחה [יקרחו] קרחה בראשם ופאת זקנם לא יגלחו ובבשרם לא ישרטו שרטת
Leviticus 21:6,קדשים יהיו לאלהיהם ולא יחללו שם אלהיהם כי את אשי יהוה לחם אלהיהם הם מקריבם והיו קדש
Leviticus 21:7,אשה זנה וחללה לא יקחו ואשה גרושה מאישה לא יקחו כי קדש הוא לאלהיו
Leviticus 21:8,וקדשתו כי את לחם אלהיך הוא מקריב קדש יהיה לך כי קדוש אני יהוה מקדשכם
Leviticus 21:9,ובת איש כהן כי תחל לזנות את אביה היא מחללת באש תשרף
Leviticus 21:10,והכהן הגדול מאחיו א‍שר יוצק על ראשו שמן המשחה ומלא את ידו ללבש את הבגדים את ראשו לא יפרע ובגדיו לא יפרם
Leviticus 21:11,ועל כל נפשת מת לא יבא לאביו ולאמו לא יטמא
Leviticus 21:12,ומן המקדש לא יצא ולא יחלל את מקדש אלהיו כי נזר שמן משחת אלהיו עליו אני יהוה
Leviticus 21:13,והוא אשה בבתוליה יקח
Leviticus 21:14,אלמנה וגרושה וחללה זנה את אלה לא יקח כי אם בתולה מעמיו יקח אשה
Leviticus 21:15,ולא יחלל זרעו בעמיו כי אני יהוה מקדשו
Leviticus 21:16,וידבר יהוה אל משה לאמר
Leviticus 21:17,דבר אל אהרן לאמר איש מזרעך לדרתם אשר יהיה בו מום לא יקרב להקריב לחם אלהיו
Leviticus 21:18,כי כל איש אשר בו מום לא יקרב איש עור או פסח או חרם או שרוע
Leviticus 21:19,או איש אשר יהיה בו שבר רגל או שבר יד
Leviticus 21:20,או גבן או דק או תבלל בעינו או גרב או ילפת או מרוח אשך
Leviticus 21:21,כל איש אשר בו מום מזרע אהרן הכהן לא יגש להקריב את אשי יהוה מום בו את לחם אלהיו לא יגש להקריב
Leviticus 21:22,לחם אלהיו מקדשי הקדשים ומן הקדשים יאכל
Leviticus 21:23,אך אל הפרכת לא יבא ואל המזבח לא יגש כי מום בו ולא יחלל את מקדשי כי אני יהוה מקדשם
Leviticus 21:24,וידבר משה אל אהרן ואל בניו ואל כל בני ישראל
Leviticus 22:1,וידבר יהוה אל משה לאמר
Leviticus 22:2,דבר אל אהרן ואל בניו וינזרו מקדשי בני ישראל ולא יחללו את שם קדשי אשר הם מקדשים לי אני יהוה
Leviticus 22:3,אמר אלהם לדרתיכם כל איש אשר יקרב מכל זרעכם אל הקדשים אשר יקדישו בני ישראל ליהוה וטמאתו עליו ונכרתה הנפש ההוא מלפני אני יהוה
Leviticus 22:4,איש איש מזרע אהרן והוא צרוע או זב בקדשים לא יאכל עד אשר יטהר והנגע בכל טמא נפש או איש אשר תצא ממנו שכבת זרע
Leviticus 22:5,או איש אשר יגע בכל שרץ אשר יטמא לו או באדם אשר יטמא לו לכל טמאתו
Leviticus 22:6,נפש אשר תגע בו וטמאה עד הערב ולא יאכל מן הקדשים כי אם רחץ בשרו במים
Leviticus 22:7,ובא השמש וטהר ואחר יאכל מן הקדשים כי לחמו הוא
Leviticus 22:8,נבלה וטרפה לא יאכל לטמאה בה אני יהוה
Leviticus 22:9,ושמרו את משמרתי ולא ישאו עליו חטא ומתו בו כי יחללהו אני יהוה מקדשם
Leviticus 22:10,וכל זר לא יאכל קדש תושב כהן ושכיר לא יאכל קדש
Leviticus 22:11,וכהן כי יקנה נפש קנין כספו הוא יאכל בו ויליד ביתו הם יאכלו בלחמו
Leviticus 22:12,ובת כהן כי תהיה לאיש זר הוא בתרומת הקדשים לא תאכל
Leviticus 22:13,ובת כהן כי תהיה אלמנה וגרושה וזרע אין לה ושבה אל בית אביה כנעוריה מלחם אביה תאכל וכל זר לא יאכל בו
Leviticus 22:14,ואיש כי יאכל קדש בשגגה ויסף חמשיתו עליו ונתן לכהן את הקדש
Leviticus 22:15,ולא יחללו את קדשי בני ישראל את אשר ירימו ליהוה
Leviticus 22:16,והשיאו אותם עון אשמה באכלם את קדשיהם כי אני יהוה מקדשם
Leviticus 22:17,וידבר יהוה אל משה לאמר
Leviticus 22:18,דבר אל אהרן ואל בניו ואל כל בני ישראל ואמרת אלהם איש איש מבית ישראל ומן הגר בישראל אשר יקריב קרבנו לכל נדריהם ולכל נדבותם אשר יקריבו ליהוה לעלה
Leviticus 22:19,לרצנכם תמים זכר בבקר בכשבים ובעזים
Leviticus 22:20,כל אשר בו מום לא תקריבו כי לא לרצון יהיה לכם
Leviticus 22:21,ואיש כי יקריב זבח שלמים ליהוה לפלא נדר או לנדבה בבקר או בצאן תמים יהיה לרצון כל מום לא יהיה בו
Leviticus 22:22,עורת או שבור או חרוץ או יבלת או גרב או ילפת לא תקריבו אלה ליהוה ואשה לא תתנו מהם על המזבח ליהוה
Leviticus 22:23,ושור ושה שרוע וקלוט נדבה תעשה אתו ולנדר לא ירצה
Leviticus 22:24,ומעוך וכתות ונתוק וכרות לא תקריבו ליהוה ובארצכם לא תעשו
Leviticus 22:25,ומיד בן נכר לא תקריבו את לחם אלהיכם מכל אלה כי משחתם בהם מום בם לא ירצו לכם
Leviticus 22:26,וידבר יהוה אל משה לאמר
Leviticus 22:27,שור או כשב או עז כי יולד והיה שבעת ימים תחת אמו ומיום השמיני והלאה ירצה לקרבן אשה ליהוה
Leviticus 22:28,ושור או שה אתו ואת בנו לא תשחטו ביום אחד
Leviticus 22:29,וכי תזבחו זבח תודה ליהוה לרצנכם תזבחו
Leviticus 22:30,ביום ההוא יאכל לא תותירו ממנו עד בקר אני יהוה
Leviticus 22:31,ושמרתם מצותי ועשיתם אתם אני יהוה
Leviticus 22:32,ולא תחללו את שם קדשי ונקדשתי בתוך בני ישראל אני יהוה מקדשכם
Leviticus 22:33,המוציא אתכם מארץ מצרים להיות לכם לאלהים אני יהוה
Leviticus 23:1,וידבר יהוה אל משה לאמר
Leviticus 23:2,דבר אל בני ישראל ואמרת אלהם מועדי יהוה אשר תקראו אתם מקראי קדש אלה הם מועדי
Leviticus 23:3,ששת ימים תעשה מלאכה וביום השביעי שבת שבתון מקרא קדש כל מלאכה לא תעשו שבת הוא ליהוה בכל מושבתיכם
Leviticus 23:4,אלה מועדי יהוה מקראי קדש אשר תקראו אתם במועדם
Leviticus 23:5,בחדש הראשון בארבעה עשר לחדש בין הערבים פסח ליהוה
Leviticus 23:6,ובחמשה עשר יום לחדש הזה חג המצות ליהוה שבעת ימים מצות תאכלו
Leviticus 23:7,ביום הראשון מקרא קדש יהיה לכם כל מלאכת עבדה לא תעשו
Leviticus 23:8,והקרבתם אשה ליהוה שבעת ימים ביום השביעי מקרא קדש כל מלאכת עבדה לא תעשו
Leviticus 23:9,וידבר יהוה אל משה לאמר
Leviticus 23:10,דבר אל בני ישראל ואמרת אלהם כי תבאו אל הארץ אשר אני נתן לכם וקצרתם את קצירה והבאתם את עמר ראשית קצירכם אל הכהן
Leviticus 23:11,והניף את העמר לפני יהוה לרצנכם ממחרת השבת יניפנו הכהן
Leviticus 23:12,ועשיתם ביום הניפכם את העמר כבש תמים בן שנתו לעלה ליהוה
Leviticus 23:13,ומנחתו שני עשרנים סלת בלולה בשמן אשה ליהוה ריח ניחח ונסכה יין רביעת ההין
Leviticus 23:14,ולחם וקלי וכרמל לא תאכלו עד עצם היום הזה עד הביאכם את קרבן אלהיכם חקת עולם לדרתיכם בכל משבתיכם
Leviticus 23:15,וספרתם לכם ממחרת השבת מיום הביאכם את עמר התנופה שבע שבתות תמימת תהיינה
Leviticus 23:16,עד ממחרת השבת השביעת תספרו חמשים יום והקרבתם מנחה חדשה ליהוה
Leviticus 23:17,ממושבתיכם תביאו לחם תנופה שתים שני עשרנים סלת תהיינה חמץ תאפינה בכורים ליהוה
Leviticus 23:18,והקרבתם על הלחם שבעת כבשים תמימם בני שנה ופר בן בקר אחד ואילם שנים יהיו עלה ליהוה ומנחתם ונסכיהם אשה ריח ניחח ליהוה
Leviticus 23:19,ועשיתם שעיר עזים אחד לחטאת ושני כבשים בני שנה לזבח שלמים
Leviticus 23:20,והניף הכהן אתם על לחם הבכורים תנופה לפני יהוה על שני כבשים קדש יהיו ליהוה לכהן
Leviticus 23:21,וקראתם בעצם היום הזה מקרא קדש יהיה לכם כל מלאכת עבדה לא תעשו חקת עולם בכל מושבתיכם לדרתיכם
Leviticus 23:22,ובקצרכם את קציר ארצכם לא תכלה פאת שדך בקצרך ולקט קצירך לא תלקט לעני ולגר תעזב אתם אני יהוה אלהיכם
Leviticus 23:23,וידבר יהוה אל משה לאמר
Leviticus 23:24,דבר אל בני ישראל לאמר בחדש השביעי באחד לחדש יהיה לכם שבתון זכרון תרועה מקרא קדש
Leviticus 23:25,כל מלאכת עבדה לא תעשו והקרבתם אשה ליהוה
Leviticus 23:26,וידבר יהוה אל משה לאמר
Leviticus 23:27,אך בעשור לחדש השביעי הזה יום הכפרים הוא מקרא קדש יהיה לכם ועניתם את נפשתיכם והקרבתם אשה ליהוה
Leviticus 23:28,וכל מלאכה לא תעשו בעצם היום הזה כי יום כפרים הוא לכפר עליכם לפני יהוה אלהיכם
Leviticus 23:29,כי כל הנפש אשר לא תענה בעצם היום הזה ונכרתה מעמיה
Leviticus 23:30,וכל הנפש אשר תעשה כל מלאכה בעצם היום הזה והאבדתי את הנפש ההוא מקרב עמה
Leviticus 23:31,כל מלאכה לא תעשו חקת עולם לדרתיכם בכל משבתיכם
Leviticus 23:32,שבת שבתון הוא לכם ועניתם את נפשתיכם בתשעה לחדש בערב מערב עד ערב תשבתו שבתכם
Leviticus 23:33,וידבר יהוה אל משה לאמר
Leviticus 23:34,דבר אל בני ישראל לאמר בחמשה עשר יום לחדש השביעי הזה חג הסכות שבעת ימים ליהוה
Leviticus 23:35,ביום הראשון מקרא קדש כל מלאכת עבדה לא תעשו
Leviticus 23:36,שבעת ימים תקריבו אשה ליהוה ביום השמיני מקרא קדש יהיה לכם והקרבתם אשה ליהוה עצרת הוא כל מלאכת עבדה לא תעשו
Leviticus 23:37,אלה מועדי יהוה אשר תקראו אתם מקראי קדש להקריב אשה ליהוה עלה ומנחה זבח ונסכים דבר יום ביומו
Leviticus 23:38,מלבד שבתת יהוה ומלבד מתנותיכם ומלבד כל נדריכם ומלבד כל נדבותיכם אשר תתנו ליהוה
Leviticus 23:39,אך בחמשה עשר יום לחדש השביעי באספכם את תבואת הארץ תחגו את חג יהוה שבעת ימים ביום הראשון שבתון וביום השמיני שבתון
Leviticus 23:40,ולקחתם לכם ביום הראשון פרי עץ הדר כפת תמרים וענף עץ עבת וערבי נחל ושמחתם לפני יהוה אלהיכם שבעת ימים
Leviticus 23:41,וחגתם אתו חג ליהוה שבעת ימים בשנה חקת עולם לדרתיכם בחדש השביעי תחגו אתו
Leviticus 23:42,בסכת תשבו שבעת ימים כל האזרח בישראל ישבו בסכת
Leviticus 23:43,למען ידעו דרתיכם כי בסכות הושבתי את בני ישראל בהוציאי אותם מארץ מצרים אני יהוה אלהיכם
Leviticus 23:44,וידבר משה את מעדי יהוה אל בני ישראל
Leviticus 24:1,וידבר יהוה אל משה לאמר
Leviticus 24:2,צו את בני ישראל ויקחו אליך שמן זית זך כתית למאור להעלת נר תמיד
Leviticus 24:3,מחוץ לפרכת העדת באהל מועד יערך אתו אהרן מערב עד בקר לפני יהוה תמיד חקת עולם לדרתיכם
Leviticus 24:4,על המנרה הטהרה יערך את הנרות לפני יהוה תמיד
Leviticus 24:5,ולקחת סלת ואפית אתה שתים עשרה חלות שני עשרנים יהיה החלה האחת
Leviticus 24:6,ושמת אותם שתים מערכות שש המערכת על השלחן הטהר לפני יהוה
Leviticus 24:7,ונתת על המערכת לבנה זכה והיתה ללחם לאזכרה אשה ליהוה
Leviticus 24:8,ביום השבת ביום השבת יערכנו לפני יהוה תמיד מאת בני ישראל ברית עולם
Leviticus 24:9,והיתה לאהרן ולבניו ואכלהו במקום קדש כי קדש קדשים הוא לו מאשי יהוה חק עולם
Leviticus 24:10,ויצא בן אשה ישראלית והוא בן איש מצרי בתוך בני ישראל וינצו במחנה בן הישראלית ואיש הישראלי
Leviticus 24:11,ויקב בן האשה הישראלית את השם ויקלל ויביאו אתו אל משה ושם אמו שלמית בת דברי למטה דן
Leviticus 24:12,ויניחהו במשמר לפרש להם על פי יהוה
Leviticus 24:13,וידבר יהוה אל משה לאמר
Leviticus 24:14,הוצא את המקלל אל מחוץ למחנה וסמכו כל השמעים את ידיהם על ראשו ורגמו אתו כל העדה
Leviticus 24:15,ואל בני ישראל תדבר לאמר איש איש כי יקלל אלהיו ונשא חטאו
Leviticus 24:16,ונקב שם יהוה מות יומת רגום ירגמו בו כל העדה כגר כאזרח בנקבו שם יומת
Leviticus 24:17,ואיש כי יכה כל נפש אדם מות יומת
Leviticus 24:18,ומכה נפש בהמה ישלמנה נפש תחת נפש
Leviticus 24:19,ואיש כי יתן מום בעמיתו כאשר עשה כן יעשה לו
Leviticus 24:20,שבר תחת שבר עין תחת עין שן תחת שן כאשר יתן מום באדם כן ינתן בו
Leviticus 24:21,ומכה בהמה ישלמנה ומכה אדם יומת
Leviticus 24:22,משפט אחד יהיה לכם כגר כאזרח יהיה כי אני יהוה אלהיכם
Leviticus 24:23,וידבר משה אל בני ישראל ויוציאו את המקלל אל מחוץ למחנה וירגמו אתו אבן ובני ישראל עשו כאשר צוה יהוה את משה
Leviticus 25:1,וידבר יהוה אל משה בהר סיני לאמר
Leviticus 25:2,דבר אל בני ישראל ואמרת אלהם כי תבאו אל הארץ אשר אני נתן לכם ושבתה הארץ שבת ליהוה
Leviticus 25:3,שש שנים תזרע שדך ושש שנים תזמר כרמך ואספת את תבואתה
Leviticus 25:4,ובשנה השביעת שבת שבתון יהיה לארץ שבת ליהוה שדך לא תזרע וכרמך לא תזמר
Leviticus 25:5,את ספיח קצירך לא תקצור ואת ענבי נזירך לא תבצר שנת שבתון יהיה לארץ
Leviticus 25:6,והיתה שבת הארץ לכם לאכלה לך ולעבדך ולאמתך ולשכירך ולתושבך הגרים עמך
Leviticus 25:7,ולבהמתך ולחיה אשר בארצך תהיה כל תבואתה לאכל
Leviticus 25:8,וספרת לך שבע שבתת שנים שבע שנים שבע פעמים והיו לך ימי שבע שבתת השנים תשע וארבעים שנה
Leviticus 25:9,והעברת שופר תרועה בחדש השבעי בעשור לחדש ביום הכפרים תעבירו שופר בכל ארצכם
Leviticus 25:10,וקדשתם את שנת החמשים שנה וקראתם דרור בארץ לכל ישביה יובל הוא תהיה לכם ושבתם איש אל אחזתו ואיש אל משפחתו תשבו
Leviticus 25:11,יובל הוא שנת החמשים שנה תהיה לכם לא תזרעו ולא תקצרו את ספיחיה ולא תבצרו את נזריה
Leviticus 25:12,כי יובל הוא קדש תהיה לכם מן השדה תאכלו את תבואתה
Leviticus 25:13,בשנת היובל הזאת תשבו איש אל אחזתו
Leviticus 25:14,וכי תמכרו ממכר לעמיתך או קנה מיד עמיתך אל תונו איש את אחיו
Leviticus 25:15,במספר שנים אחר היובל תקנה מאת עמיתך במספר שני תבואת ימכר לך
Leviticus 25:16,לפי רב השנים תרבה מקנתו ולפי מעט השנים תמעיט מקנתו כי מספר תבואת הוא מכר לך
Leviticus 25:17,ולא תונו איש את עמיתו ויראת מאלהיך כי אני יהוה אלהיכם
Leviticus 25:18,ועשיתם את חקתי ואת משפטי תשמרו ועשיתם אתם וישבתם על הארץ לבטח
Leviticus 25:19,ונתנה הארץ פריה ואכלתם לשבע וישבתם לבטח עליה
Leviticus 25:20,וכי תאמרו מה נאכל בשנה השביעת הן לא נזרע ולא נאסף את תבואתנו
Leviticus 25:21,וצויתי את ברכתי לכם בשנה הששית ועשת את התבואה לשלש השנים
Leviticus 25:22,וזרעתם את השנה השמינת ואכלתם מן התבואה ישן עד השנה התשיעת עד בוא תבואתה תאכלו ישן
Leviticus 25:23,והארץ לא תמכר לצמתת כי לי הארץ כי גרים ותושבים אתם עמדי
Leviticus 25:24,ובכל ארץ אחזתכם גאלה תתנו לארץ
Leviticus 25:25,כי ימוך אחיך ומכר מאחזתו ובא גאלו הקרב אליו וגאל את ממכר אחיו
Leviticus 25:26,ואיש כי לא יהיה לו גאל והשיגה ידו ומצא כדי גאלתו
Leviticus 25:27,וחשב את שני ממכרו והשיב את העדף לאיש אשר מכר לו ושב לאחזתו
Leviticus 25:28,ואם לא מצאה ידו די השיב לו והיה ממכרו ביד הקנה אתו עד שנת היובל ויצא ביבל ושב לאחזתו
Leviticus 25:29,ואיש כי ימכר בית מושב עיר חומה והיתה גאלתו עד תם שנת ממכרו ימים תהיה גאלתו
Leviticus 25:30,ואם לא יגאל עד מלאת לו שנה תמימה וקם הבית אשר בעיר אשר לא [לו] חמה לצמיתת לקנה אתו לדרתיו לא יצא ביבל
Leviticus 25:31,ובתי החצרים אשר אין להם חמה סביב על שדה הארץ יחשב גאלה תהיה לו וביבל יצא
Leviticus 25:32,וערי הלוים בתי ערי אחזתם גאלת עולם תהיה ללוים
Leviticus 25:33,ואשר יגאל מן הלוים ויצא ממכר בית ועיר אחזתו ביבל כי בתי ערי הלוים הוא אחזתם בתוך בני ישראל
Leviticus 25:34,ושדה מגרש עריהם לא ימכר כי אחזת עולם הוא להם
Leviticus 25:35,וכי ימוך אחיך ומטה ידו עמך והחזקת בו גר ותושב וחי עמך
Leviticus 25:36,אל תקח מאתו נשך ותרבית ויראת מאלהיך וחי אחיך עמך
Leviticus 25:37,את כספך לא תתן לו בנשך ובמרבית לא תתן אכלך
Leviticus 25:38,אני יהוה אלהיכם אשר הוצאתי אתכם מארץ מצרים לתת לכם את ארץ כנען להיות לכם לאלהים
Leviticus 25:39,וכי ימוך אחיך עמך ונמכר לך לא תעבד בו עבדת עבד
Leviticus 25:40,כשכיר כתושב יהיה עמך עד שנת היבל יעבד עמך
Leviticus 25:41,ויצא מעמך הוא ובניו עמו ושב אל משפחתו ואל אחזת אבתיו ישוב
Leviticus 25:42,כי עבדי הם אשר הוצאתי אתם מארץ מצרים לא ימכרו ממכרת עבד
